ledger_id,gate,priority,domain,current_closeout_status,real_closeout_state,simulation_decision_available,simulated_human_decision,required_evidence,real_closeout_action,claim_status
GB-001,Gate B,P0,MSG source-data coverage,closed_by_human_review,closed_real_attested_unverified,no,,Per-patient source decision for each P0 MSG patient: recovered wearable segment manifest or advisor-approved exclusion record; rerun MSG triage showing zero p0_blocker rows.,Keep attestation; rerun guardrails after every Gate B row is closed.,gate_b_real_closeout_pending_validation_not_citable
GB-002,Gate B,P0,SeizeIT2 full-cohort evidence,closed_by_human_review,closed_real_attested_unverified,no,,"Official SeizeIT2 split manifest, expected-count source citations, full-cohort artifact coverage, and rerun cohort readiness with no P0 blockers.",Keep attestation; rerun guardrails after every Gate B row is closed.,gate_b_real_closeout_pending_validation_not_citable
GB-003,Gate C,P0,Freeze prerequisite,closed_by_human_review,closed_real_attested_unverified,no,,"Completed Gate B ledger, clean guardrail rerun, and Gate C dry-run reporting ready_for_gate_c_review before split freeze.",Keep attestation; rerun guardrails after every Gate B row is closed.,gate_b_real_closeout_pending_validation_not_citable
GB-004,Gate B,P1,MSG denominator integrity,closed_by_human_review,closed_real_attested_unverified,no,,"Denominator policy signed off for source, matched, and prediction-coverable events; regenerated leaderboard rows expose all denominator fields.",Keep attestation; rerun guardrails after every Gate B row is closed.,gate_b_real_closeout_pending_validation_not_citable
GB-005,Gate B,P1,MSG horizon feasibility,closed_by_human_review,closed_real_attested_unverified,no,,Advisor-approved main horizon choice or documented demotion to feasibility-negative analysis; regenerated horizon triage for chosen horizons.,Keep attestation; rerun guardrails after every Gate B row is closed.,gate_b_real_closeout_pending_validation_not_citable
GB-006,Gate B,P1,SeizeIT2 track completeness,closed_by_human_review,closed_real_attested_unverified,no,,"Ready track matrix covering required splits, tasks, and modality tracks; count summary matching documented expected counts.",Keep attestation; rerun guardrails after every Gate B row is closed.,gate_b_real_closeout_pending_validation_not_citable
GB-007,Gate B,P2,MSG horizon source review,closed_by_human_review,closed_real_attested_unverified,no,,Source-review decision for each source-review-required horizon and evidence that chosen main horizons no longer depend on unresolved event gaps.,Keep attestation; rerun guardrails after every Gate B row is closed.,gate_b_real_closeout_pending_validation_not_citable
GB-008,Gate B,P2,SeizeIT2 negative readiness rows,closed_by_human_review,closed_real_attested_unverified,no,,Paper-table or appendix plan preserving non-ready tracks as explicit negative readiness findings.,Keep attestation; rerun guardrails after every Gate B row is closed.,gate_b_real_closeout_pending_validation_not_citable
