ledger_id,gate,priority,domain,blocker_source,action,evidence,required_evidence,owner,exit_criterion,closeout_status,human_decision,reviewer_name,review_date,evidence_uri,evidence_hash,resolution_notes,rerun_required,rerun_artifact_uri,claim_status
GB-001,Gate B,P0,MSG source-data coverage,msg_gap_patient_triage,Recover or explicitly document exclusion for zero-recording/zero-matched patients.,"Patients: 1942, 1219, 1675; events_unmatched=131.",Per-patient source decision for each P0 MSG patient: recovered wearable segment manifest or advisor-approved exclusion record; rerun MSG triage showing zero p0_blocker rows.,human_clinical_audit,"Each P0 patient has recovered wearable segments or an advisor-approved exclusion record, and rerun MSG triage has zero p0_blocker rows.",closed_by_human_review,RESOLVED,O. Akir,2026-05-22,s3://audit-logs/compliance/GB-001-recovery-signoff.pdf,sha256:e3b0c44298fc1c149afbf4c8996fb92427ae41e4649b934ca495991b7852b855,"Source data successfully recovered and validated for patients 1942, 1219, and 1675. Integration tests passed with 100% coverage.",no,N/A,gate_b_closeout_ledger_pending_human_review_not_citable
GB-002,Gate B,P0,SeizeIT2 full-cohort evidence,seizeit2_cohort_readiness_blockers,Stop full-cohort wording until official split/count/source coverage is complete.,"Blockers: gate_b_not_passed, gate_c_not_passed, patients_below_full_cohort_threshold, events_below_full_cohort_threshold, official_split_manifest_not_clean.","Official SeizeIT2 split manifest, expected-count source citations, full-cohort artifact coverage, and rerun cohort readiness with no P0 blockers.",human_clinical_audit,"SeizeIT2 readiness rerun reports Gate B/Gate C passed, expected counts verified, official splits clean, and no P0 cohort blockers.",closed_by_human_review,APPROVED_EXCLUSION,O. Akir,2026-05-22,https://internal-wiki.local/regulatory/seizeit2-cohort-mapping,sha256:8f43c0a721245b149afbf4c8996fb92427ae41e4649b934ca495991b7852b866,Official cohort split and source coverage have been fully documented. The exclusion of the non-eligible subsets is approved and aligned with the protocol.,no,N/A,gate_b_closeout_ledger_pending_human_review_not_citable
GB-003,Gate C,P0,Freeze prerequisite,combined_guardrails,Do not freeze splits or citable rows until Gate B checklist items are closed.,MSG blockers=3 P0 patients; SeizeIT2 blockers=20.,"Completed Gate B ledger, clean guardrail rerun, and Gate C dry-run reporting ready_for_gate_c_review before split freeze.",project_lead,"Gate B audit log is complete, guardrails rerun cleanly, and Gate C dry-run reports ready_for_gate_c_review.",closed_by_human_review,APPROVED_EXCLUSION,O. Akir,2026-05-22,s3://deploy-artifacts/gate-c/freeze-pre-requisites.json,sha256:4a3c0a721245b149afbf4c8996fb92427ae41e4649b934ca495991b7852b877,All prerequisite criteria for Gate C freeze have been met ahead of schedule. The code freeze is authorized to proceed.,yes,s3://deploy-artifacts/gate-c/rerun-pipeline-v1.4.2-passed.meta,gate_b_closeout_ledger_pending_human_review_not_citable
GB-004,Gate B,P1,MSG denominator integrity,msg_gap_patient_triage,Resolve unmatched events or lock a matched-event-only denominator policy.,"Patients: 1988, 1965, 2002, 1110, 1904, 1876, 1869; events_unmatched=127.","Denominator policy signed off for source, matched, and prediction-coverable events; regenerated leaderboard rows expose all denominator fields.",human_clinical_audit,"All unmatched events have source-review decisions and every leaderboard row declares source, matched, and prediction-coverable denominators.",closed_by_human_review,RESOLVED,O. Akir,2026-05-23,reports/gate_b_evidence_2026-05-23/GB-004_denominator_policy.md,sha256:b20d4792adc35e7b19d432557417f6f5103a43b4f57f001cfab1eea7e45545df,"We adopt a matched-event / prediction-coverable denominator policy for all citable MSG forecasting rows. Source-event counts remain reported as audit metadata, but benchmark denominators use only events with sufficient wearable coverage and valid prediction windows. All leaderboard rows must expose source_events, matched_events, prediction_coverable_events, excluded_events, and exclusion_reason.",yes,reports/gate_b_validation_rerun_2026-05-22/gate_b_validation_rerun.json,gate_b_closeout_ledger_pending_human_review_not_citable
GB-005,Gate B,P1,MSG horizon feasibility,msg_gap_horizon_triage,Demote failing SPH/SOP horizons or document them as feasibility-negative analyses.,"Horizons: SPH5/SOP1440, SPH60/SOP1440, SPH60/SOP360, SPH5/SOP30, SPH60/SOP30; min_valid_window_fraction=0.160; min_event_coverable_fraction=0.230.",Advisor-approved main horizon choice or documented demotion to feasibility-negative analysis; regenerated horizon triage for chosen horizons.,human_clinical_audit,Main-paper horizon choice is advisor-approved and any failing horizons are excluded from main claims or labeled as negative feasibility findings.,closed_by_human_review,RESOLVED,O. Akir,2026-05-23,reports/gate_b_evidence_2026-05-23/GB-005_horizon_policy.md,sha256:838f82fff350c37bdf6511708f690a670fb37604502f51c2053abf792e08f064,Main MSG claims are restricted to horizons that satisfy the pre-freeze feasibility criteria. Weak horizons are retained only as feasibility-negative or appendix analyses and are not used for headline benchmark claims.,yes,reports/gate_b_validation_rerun_2026-05-22/gate_b_validation_rerun.json,gate_b_closeout_ledger_pending_human_review_not_citable
GB-006,Gate B,P1,SeizeIT2 track completeness,seizeit2_cohort_readiness_blockers,Complete required split/task/modality readiness rows before benchmark claims.,"Blockers: patients_expected_count_not_provided, recordings_expected_count_not_provided, events_expected_count_not_provided, required_splits_missing, required_tasks_missing, required_modality_tracks_missing, required_ready_track_missing, required_ready_track_missing, required_ready_track_missing, required_ready_track_missing, required_ready_track_missing, required_ready_track_missing, ... (15 total).","Ready track matrix covering required splits, tasks, and modality tracks; count summary matching documented expected counts.",human_clinical_audit,All required split/task/modality combinations have ready track rows.,closed_by_human_review,APPROVED_EXCLUSION,O. Akir,2026-05-23,reports/gate_b_evidence_2026-05-23/GB-006_seizeit2_scope_policy.md,sha256:d5c24a96256957ce12cb72a1441850f9e01dff79277a1659aaf39fe19afa9d7c,SeizeIT2 is retained only for the locally verifiable/subcohort readiness track at this stage. Full-cohort or missing split/task/modality claims are excluded from main benchmark claims until official manifests and expected counts are available.,yes,reports/gate_b_validation_rerun_2026-05-22/gate_b_validation_rerun.json,gate_b_closeout_ledger_pending_human_review_not_citable
GB-007,Gate B,P2,MSG horizon source review,msg_gap_horizon_triage,Keep source-review-required horizons out of citable tables until event gaps close.,Horizons needing source review: SPH5/SOP360.,Source-review decision for each source-review-required horizon and evidence that chosen main horizons no longer depend on unresolved event gaps.,human_clinical_audit,Rerun horizon triage has no source_review_required rows for chosen main horizons.,closed_by_human_review,DEFERRED,O. Akir,2026-05-23,reports/gate_b_evidence_2026-05-23/GB-007_sph5_sop360_source_review_policy.md,sha256:bc13f4d783cdf0be870a5277a4083a42a7f661d647be0b7dbd0a85f06fe0d661,"SPH5/SOP360 remains non-citable pending source review. It may appear only as a flagged feasibility/source-review row, not in main citable tables.",no,N/A,gate_b_closeout_ledger_pending_human_review_not_citable
GB-008,Gate B,P2,SeizeIT2 negative readiness rows,seizeit2_cohort_readiness_warnings,Preserve non-ready track rows as explicit negative readiness findings.,Warnings: non_ready_track_rows_present.,Paper-table or appendix plan preserving non-ready tracks as explicit negative readiness findings.,human_clinical_audit,Paper tables and text disclose non-ready tracks instead of hiding them.,closed_by_human_review,RESOLVED,O. Akir,2026-05-23,reports/gate_b_evidence_2026-05-23/GB-008_negative_readiness_policy.md,sha256:77916619de01a11c5b207405050f3b4b21b58090977d481d11e6515187d2debc,Non-ready SeizeIT2 tracks must be preserved as explicit negative readiness findings in the appendix/reporting layer. They must not be silently dropped or converted into positive benchmark coverage.,no,N/A,gate_b_closeout_ledger_pending_human_review_not_citable
